{
  "id": "case-2026-005",
  "date": "2026-09-23",
  "kind": "contract",
  "features": {
    "contract_kind": "construction",
    "work_type": "capital_repair",
    "customer_kind": "operator",
    "member_role": "contractor",
    "procurement": "competitive",
    "status": "active",
    "price_band": "до 10 млн ₽",
    "object_category": "ordinary",
    "works": [
      {
        "name": "Ремонт инженерных систем холодного водоснабжения (02-01-01)",
        "auto_code": "III/15.1",
        "auto_sro": false
      },
      {
        "name": "Ремонт инженерных систем горячего водоснабжения (02-01-02)",
        "auto_code": "III/15.1",
        "auto_sro": false
      },
      {
        "name": "Ремонт инженерных систем теплоснабжения (02-01-03)",
        "auto_code": "III/15.2",
        "auto_sro": false
      },
      {
        "name": "Ремонт инженерных систем водоотведения (02-01-04)",
        "auto_code": "III/15.1",
        "auto_sro": false
      }
    ]
  },
  "auto": {
    "membership_required": "no",
    "counts_for_odo": "no",
    "sro_kind": "build",
    "share_sro": 0.0
  },
  "human": {
    "decision": "Не входит в ОДО: капитальный ремонт инженерных систем здания для бюджетного учреждения (эксплуатанта), контракт по 44-ФЗ на аукционе, цена ниже 10 млн — членство не требуется, в совокупный размер не включается. Подтверждено пользователем по рекомендации скрипта.",
    "agrees_with_auto": true,
    "note": "Второй такой же случай подряд. В шапке сводного сметного расчёта стояла другая сумма, чем в итоге расчёта и в цене контракта — расхождение в документе заказчика, на вывод не влияет: обе суммы ниже порога.",
    "decided_by": "проверяющий"
  },
  "basis": [
    "fz-124",
    "fz-223",
    "fz-372",
    "fz-44",
    "gk-702",
    "gk-740",
    "grk-1-10",
    "grk-1-14.2",
    "grk-47-2",
    "grk-48-4",
    "grk-48.1",
    "grk-51-17",
    "grk-52-2.1",
    "grk-55.25-1",
    "grk-55.8-3",
    "grk-55.8-4",
    "letter-33838",
    "minstroy-18965",
    "nostroy-2022-05-11",
    "order-624",
    "order-624-note"
  ],
  "keywords": [
    "водоот",
    "водосн",
    "горяче",
    "инжене",
    "ремонт",
    "систем",
    "теплос",
    "холодн"
  ],
  "rule_suggestion": null,
  "source_files": []
}
