{
  "id": "case-2026-001",
  "date": "2026-09-23",
  "kind": "contract",
  "features": {
    "contract_kind": "construction",
    "work_type": "construction",
    "customer_kind": "developer",
    "member_role": "contractor",
    "procurement": "direct",
    "status": "active",
    "price_band": "90–500 млн ₽",
    "object_category": "ordinary",
    "works": [
      {
        "name": "Устройство монолитного железобетонного каркаса (фундаментная плита, стены, перекрытия)",
        "auto_code": "III/6.3",
        "auto_sro": true
      },
      {
        "name": "Кладка наружных и внутренних стен из газобетонных блоков",
        "auto_code": "III/9.2",
        "auto_sro": false
      },
      {
        "name": "Устройство кровли из рулонных материалов",
        "auto_code": "III/13.2",
        "auto_sro": false
      },
      {
        "name": "Устройство внутренних систем водоснабжения, канализации и отопления",
        "auto_code": "III/15.1",
        "auto_sro": false
      },
      {
        "name": "Устройство внутренних сетей электроснабжения",
        "auto_code": "III/15.5",
        "auto_sro": false
      },
      {
        "name": "Отделочные работы: штукатурка, шпатлёвка, окраска, плитка, полы",
        "auto_code": null,
        "auto_sro": false
      },
      {
        "name": "Поставка лифтового оборудования",
        "auto_code": null,
        "auto_sro": false
      },
      {
        "name": "Монтаж лифтов и пусконаладочные работы лифтов",
        "auto_code": "III/24.2",
        "auto_sro": true
      },
      {
        "name": "Устройство наружных сетей водопровода и канализации",
        "auto_code": "III/16.1",
        "auto_sro": true
      },
      {
        "name": "Благоустройство территории: озеленение, детская площадка, малые архитектурные формы",
        "auto_code": null,
        "auto_sro": false
      }
    ]
  },
  "auto": {
    "membership_required": "yes",
    "counts_for_odo": "conditional",
    "sro_kind": "build",
    "share_sro": 0.4797,
    "summary": "Договор № ГП-14/2026 (148 000 000,00 ₽) требует членства в СРО строителей. Включение в совокупный размер по КФ ОДО зависит от прочтения ч. 3 ст. 55.8 ГрК РФ после 309-ФЗ и положения СРО (прямой договор). Остаток обязательств 108 600 000,00 ₽, из них работы, относящиеся к СРО по Перечню 624, — 52 098 648,65 ₽ (48 %)."
  },
  "human": {
    "decision": "Договор требует членства и входит в совокупный размер; прямой договор учтён по положению СРО (все договоры с застройщиком)",
    "agrees_with_auto": true,
    "note": "Учебный прецедент: отделка, поставка лифтов и благоустройство — не СРО; монолит, наружные сети, монтаж лифтов — СРО. Кладка, кровля и внутренние сети со звёздочкой на обычном объекте — не СРО.",
    "decided_by": "учебный пример"
  },
  "basis": [
    "fz-124",
    "fz-309",
    "gk-702",
    "gk-740",
    "gk-753",
    "grk-1-10",
    "grk-1-13",
    "grk-1-16",
    "grk-47-2.1",
    "grk-48-4.1",
    "grk-48.1",
    "grk-52-2.1",
    "grk-55.13-4",
    "grk-55.13-n",
    "grk-55.8-3",
    "grk-55.8-6",
    "letter-33838",
    "order-624-note"
  ],
  "keywords": [
    "архите",
    "благоу",
    "блоков",
    "внутре",
    "водопр",
    "водосн",
    "газобе",
    "детска",
    "железо",
    "канали",
    "каркас",
    "кладка",
    "кровли",
    "лифтов",
    "малые",
    "матери",
    "моноли",
    "монтаж",
    "наружн",
    "оборуд",
    "озелен",
    "окраск",
    "отдело",
    "отопле",
    "перекр",
    "плита",
    "плитка",
    "площад",
    "полы",
    "постав",
    "пускон",
    "рулонн",
    "сетей",
    "систем",
    "стен",
    "стены",
    "террит",
    "устрой",
    "формы",
    "фундам",
    "шпатле",
    "штукат",
    "электр"
  ],
  "rule_suggestion": null,
  "source_files": []
}
