{
  "id": "case-2026-002",
  "date": "2026-09-23",
  "kind": "objection",
  "features": {
    "claim_types": [
      "not_competitive",
      "works_not_in_list",
      "price_includes_supply",
      "executed",
      "state_exempt"
    ],
    "claims": [
      {
        "type": "not_competitive",
        "auto_status": null
      },
      {
        "type": "works_not_in_list",
        "auto_status": null
      },
      {
        "type": "price_includes_supply",
        "auto_status": null
      },
      {
        "type": "executed",
        "auto_status": null
      },
      {
        "type": "state_exempt",
        "auto_status": null
      }
    ]
  },
  "auto": {
    "overall": "founded"
  },
  "human": {
    "decision": "Довод о торгах принят, договор из совокупного размера исключён; доводы об отделке и об исполнении учтены для разделения и остатка; о поставке лифтов и об учреждении отклонены",
    "agrees_with_auto": null,
    "note": "Учебный прецедент",
    "decided_by": "учебный пример"
  },
  "basis": [],
  "keywords": [
    "безопа",
    "благоу",
    "включе",
    "влияют",
    "выполн",
    "догово",
    "допуск",
    "заказч",
    "заключ",
    "застро",
    "значит",
    "котора",
    "лифтов",
    "муници",
    "никогд",
    "оборуд",
    "обязат",
    "освобо",
    "отдело",
    "относи",
    "постав",
    "поэтом",
    "принят",
    "провед",
    "работа",
    "размер",
    "расчет",
    "совоку",
    "специа",
    "строит",
    "торгов",
    "требов",
    "участи",
    "учитыв",
    "цену",
    "части",
    "часть",
    "членст",
    "являет"
  ],
  "rule_suggestion": null,
  "source_files": []
}
