{
  "id": "case-2026-003",
  "date": "2026-09-23",
  "kind": "contract",
  "features": {
    "contract_kind": "construction",
    "work_type": "capital_repair",
    "customer_kind": "operator",
    "member_role": "contractor",
    "procurement": "competitive",
    "status": "active",
    "price_band": "10–90 млн ₽",
    "object_category": "ordinary",
    "works": [
      {
        "name": "Ремонт инженерных систем холодного водоснабжения (ЛСР-02-01-01)",
        "auto_code": "III/15.1",
        "auto_sro": false
      },
      {
        "name": "Ремонт инженерных систем горячего водоснабжения (ЛСР-02-01-02)",
        "auto_code": "III/15.1",
        "auto_sro": false
      },
      {
        "name": "Ремонт инженерных систем теплоснабжения (ЛСР-02-01-03)",
        "auto_code": "III/15.2",
        "auto_sro": false
      },
      {
        "name": "Ремонт инженерных систем водоотведения (ЛСР-02-01-04)",
        "auto_code": "III/15.1",
        "auto_sro": false
      }
    ]
  },
  "auto": {
    "membership_required": "yes",
    "counts_for_odo": "yes",
    "sro_kind": "build",
    "share_sro": 0.0
  },
  "human": {
    "decision": "Входит в ОДО: капитальный ремонт инженерных систем здания для бюджетного учреждения (эксплуатанта), контракт по 44-ФЗ на аукционе, цена выше 10 млн",
    "agrees_with_auto": true,
    "note": "Подтверждено пользователем. Сметы по Методике 421/пр закрывают довод о текущем ремонте; все работы группы 15 Перечня со знаком «*» на обычном объекте — на учёт договора не влияет. КВР 244 в ИКЗ — не основание считать ремонт текущим.",
    "decided_by": "проверяющий"
  },
  "basis": [
    "fz-124",
    "fz-223",
    "fz-372",
    "fz-44",
    "gk-702",
    "gk-740",
    "grk-1-10",
    "grk-1-14.2",
    "grk-47-2",
    "grk-48-4",
    "grk-48.1",
    "grk-51-17",
    "grk-52-2.1",
    "grk-55.13-7",
    "grk-55.16-13",
    "grk-55.25-1",
    "grk-55.8-3",
    "letter-33838",
    "order-624",
    "order-624-note"
  ],
  "keywords": [
    "водоот",
    "водосн",
    "горяче",
    "инжене",
    "ремонт",
    "систем",
    "теплос",
    "холодн"
  ],
  "rule_suggestion": null,
  "source_files": []
}
